Season,Week,Day,Weekday Cycle,Sunday Cycle,Full Reference,Refrain Text,Acclamation Ref,Acclamation Text,Lectionary Number
Advent,1,Monday,I/II,,"Psalm 122.1-2, 3-4, 7-8, 9-10 (R.1)",Let us go rejoicing to the house of the Lord.,See Psalm 80.4,"Come and save us, Lord our God; let us see your face, and we shall be saved.",175
Advent,1,Tuesday,I/II,,"Psalm 72.1-2, 7-8, 12-13, 17 (R.7)","Justice shall flourish in his time, and fullness of peace for ever.",,"Behold, our Lord shall come with power; he will enlighten the eyes of his servants.",176
Advent,1,Wednesday,I/II,,"Psalm 23.1-3a, 3b-4, 5, 6 (R.6cd)",I shall dwell in the house of the Lord all the days of my life.,,The Lord is coming to save his people; happy are those prepared to meet him.,177
Advent,1,Thursday,I/II,,"Psalm 118.1, 8-9, 19-21, 25-27a (R.26a)",Blessed is he who comes in the name of the Lord.,Isaiah 55.6,Seek the Lord while he may be found. Call on him while he is near. 14 FIRST WEEK OF ADVENT,178
Advent,1,Friday,I/II,,"Psalm 27.1, 4, 13-14 (R.1a)",The Lord is my light and my salvation.,,"Behold, our Lord shall come in power; he will enlighten the eyes of his servants.",179
Advent,1,Saturday,I/II,,"Psalm 147.1-2, 3-4, 5-6 (R. Isa 30.18)",Happy are all who long for the coming of the Lord.,Isaiah 33.22,The Lord will judge us by his law; he is our King and Saviour.,180
Advent,2,Monday,I/II,,"Psalm 85.8ab-9, 10-11, 12-13 (R. Isa 35.4d)",Our God will come to save us!,,"Behold, the king will come, the Lord of earth, and he will set us free.",181
Advent,2,Tuesday,I/II,,"Psalm 96.1-2, 3 & 10ac, 11-12, 13 (R. Isa 40.10a)",The Lord our God comes in strength.,,The day of the Lord is near: he comes to save us. 20 SECOND WEEK OF ADVENT,182
Advent,2,Wednesday,I/II,,"Psalm 103.1-2, 3-4, 8+10 (R.1a)","O bless the Lord, my soul!",,The Lord is coming to save his people; happy are those prepared to meet him. 22 SECOND WEEK OF ADVENT,183
Advent,2,Thursday,I/II,,"Psalm 145.1+9, 10-11, 12-13ab (R.8)",The Lord is kind and merciful.++,Isaiah 45.8,"Let the clouds rain down the Just One, and the earth bring forth a Saviour. 24 SECOND WEEK OF ADVENT",184
Advent,2,Friday,I/II,,"Psalm 1.1-2, 3, 4+6 (R. see Jn 8.12)","Those who follow you, Lord, will have the light of life.",,The Lord will come; go out to meet him! He is the prince of peace.,185
Advent,2,Saturday,I/II,,"Psalm 80.1ac+2b, 14-15, 17-18 (R.3)","Lord, let us see your face and we shall be saved.++","Luke 3.4, 6","Prepare the way of the Lord, make straight his paths: all people shall see the salvation of God.",186
Advent,3,Monday,I/II,,"Psalm 25.4bc-5ab, 6-7bc, 8-9 (R.4)","Teach me your ways, O Lord.",Psalm 84.8,"Lord, show us your mercy and love, and grant us your salvation.",187
Advent,3,Tuesday,I/II,,"Psalm 34.1-2, 5-6, 17-18, 19+22 (R.6a)",The Lord hears the cry of the poor.,,"Come, O Lord, do not delay; forgive the sins of your people.",188
Advent,3,Wednesday,I/II,,"Psalm 85.8ab-9, 10-11, 12-14 (R. Isa 45.8)",Let the clouds rain down the Just One.++,Isaiah 40.9-10,Raise your voice and tell the good news: The Lord our God comes in strength.,189
Advent,3,Thursday,I/II,,"Psalm 30.1+3, 4-5, 10-11ac+12 (R.1a)","I will praise you, Lord, for you have rescued me.","Luke 3.4,6","Prepare the way of the Lord, make straight his paths: all people shall see the salvation of God. THURSDAY 37",190
Advent,3,Friday,I/II,,"Psalm 67.1-2, 4, 6-7 (R.3)","O God, let the nations praise you!",,"Come, Lord, bring us your peace; let us rejoice before you with a perfect heart.",191
Advent,Dec 17-24,Friday,I/II,,"Psalm 72.1-2, 3-4, 7-8, 17 (R.7)",Justice and peace shall flourish for ever.++,,"Come, Wisdom of our God Most High, guiding creation with power and love: teach us to walk in the path of knowledge!",191
Christmas,Octave,Friday,I/II,,"Psalm 31.2cd-3ab, 5+7ab, 15bc-16 (R.5a)","Into your hands, O Lord, I entrust my spirit.","Psalm 118.26a, 27a",Blessed is he who comes in the name of the Lord: the Lord shines upon us.,191
Christmas,After Epiphany,Friday,I/II,,"Psalm 2.7-8, 10-11 (R.8a)",I will give you all the nations for your heritage.,Matthew 4.23,Jesus preached the good news of the kingdom and healed all who were sick.,191
Christmas,Octave,Saturday,I/II,,"Psalm 131.1, 2, 3","In you, Lord, I have found my peace.",John 13.34,I give you a new commandment: love one another as I have loved you.,302
Ordinary Time,1,Monday,I,,"Psalm 97.1-2, 6+7ac, 8bc-9 (R.7b)","Worship the Lord, all angels of God.",Mark 1.15,The kingdom of God is near: repent and believe the good news.,305
Ordinary Time,1,Monday,I,,"Psalm 116.12-13, 14+17, 18-19 (R.17)","To you, Lord, I will offer a sacrifice of praise.",Mark 1.15,The kingdom of God is near: repent and believe the good news!,305
Ordinary Time,1,Monday,II,,"Psalm 149.1-2, 3-4, 5, 6a+9b (R.4a)",The Lord takes delight in his people.,John 10.27,"My sheep listen to my voice, says the Lord; I know them, and they follow me.",425
Ordinary Time,1,Monday,II,,"Psalm 96.1+3, 4-5, 11-12, 13 (R.13b)",The Lord comes to judge the earth.,Luke 4.18,The Spirit of the Lord now upon me has sent me to bring good news to the poor.,431
Ordinary Time,1,Monday,II,,"Psalm 69.29-30, 32-33, 35-36 (R.14c)","Lord, in your great love, answer me.",John 8.31b-32,"If you stay in my word, you will indeed be my disciples, and you will know the truth, says the Lord.",485
Ordinary Time,1,Monday,II,,"Psalm 96.1-2a, 2b-3, 4-5 (R.3)",Proclaim God’s marvellous deeds to all the nations.,John 10.27,"My sheep listen to my voice, says the Lord; I know them, and they follow me.",425
Ordinary Time,1,Monday,II,,"Psalm 119.97-98, 99-100, 101-102 (R.97a)","Lord, I love your commands.",Luke 4.18,The Spirit of the Lord now upon me has sent me to bring good news to the poor.,431
Ordinary Time,1,Monday,II,,"Psalm 131.1, 2, 3 (R. see 2)","In you, Lord, I have found my peace.",John 8.31b-32,"If you stay in my word, you will indeed be my disciples, and you will know the truth, says the Lord.",485
Ordinary Time,1,Monday,II,,"Psalm 24.1-2, 3-4ab, 5-6 (R. see 6)","Lord, this is the people that longs to see your face.","Philippians 2.15d, 16a",Shine on the world like bright stars; you are offering it the word of life.,491
Ordinary Time,1,Tuesday,I,,"Psalm 8.1-2, 3-4, 5-6ab, 6c-8 (R.6)++",You gave your Son authority over all your creation.,1 Thessalonians 2.13,"Receive this message not as human words, but as truly the word of God.",306
Ordinary Time,1,Tuesday,II,,"Psalm 139.1-2, 3-4, 5-6 (R.1)","You have searched me and you know me, Lord.",Hebrews 4.12,The word of God is living and active; it probes the thoughts and motives of our hearts.,426
Ordinary Time,1,Tuesday,II,,"Psalm 131.1, 2, 3 (R. see 2)","In you, Lord, I have found my peace.",Matthew 11.28,"Come to me, all you that labour and are burdened, and I will give you rest, says the Lord. TUESDAY 1297",486
Ordinary Time,1,Tuesday,II,,"Psalm 96.10, 11-12a, 12b-13 (R.13b)",The Lord comes to judge the earth.,Hebrews 4.12,The word of God is living and active; it probes the thoughts and motives of our hearts.,426
Ordinary Time,1,Tuesday,II,,"Psalm 22.25b-26, 27, 28-29, 30-31 (R. see 25)","I will praise you, Lord, in the assembly of your people.",Matthew 11.28,"Come to me, all you that labour and are burdened, 1704 THIRTY-FIRST WEEK IN ORDINARY TIME - YEAR II and I will give you rest, says the Lord.",486
Ordinary Time,1,Wednesday,I,,"Psalm 105.1-2, 3-4, 6-7, 8-9 (R.8)",The Lord remembers his covenant forever.,John 10.27,"My sheep listen to my voice, says the Lord: I know them, and they follow me.",307
Ordinary Time,1,Wednesday,I,,"Psalm 40.1+4, 6-7a, 7b-8, 9 (R.7-8)","Here am I, Lord, I come to do your will.",John 10.27,"My sheep listen to my voice, says the Lord: I know them, and they follow me.",307
Ordinary Time,1,Wednesday,II,,"Psalm 139.7-8, 9-10, 11-12 (R. see 1)","You have searched me and you know me, Lord.",1 John 2.5,"Whoever keeps the word of Christ, grows perfect in the love of God.",427
Ordinary Time,1,Wednesday,II,,"Psalm 112.1-2, 4-5, 9 (R. see 5)",Happy the merciful who give to those in need.,1 Peter 4.14,"If you are insulted for the name of Christ, blessed are you, for the Spirit of God rests upon you.",487
Ordinary Time,1,Wednesday,II,,"Psalm 128.1-2, 4-5 (R.1)",Happy are those who fear the Lord.,1 John 2.5,"Whoever keeps the word of Christ, grows perfect in the love of God.",427
Ordinary Time,1,Wednesday,II,,"Psalm 27.1, 4, 13-14 (R.1)",The Lord is my light and my salvation.,1 Peter 4.14,"If you are insulted for the name of Christ, blessed are you, for the Spirit of God rests upon you.",487
Ordinary Time,1,Thursday,I,,"Psalm 95.6-7, 8-9, 10-11 (R.7b-8a)","If today you hear God’s voice, harden not your hearts.",Matthew 4.23,Jesus preached the good news of the kingdom and healed all who were sick.,308
Ordinary Time,1,Thursday,I,,"Psalm 44.9-10, 13-14, 23-24 (R.26)","Save us Lord, in your mercy.",Matthew 4.23,Jesus preached the good news of the kingdom and healed all who were sick.,308
Ordinary Time,1,Thursday,II,,"Psalm 90.3-4, 12-13, 14+17 (R.14)","Fill us with your love, O Lord, and we will sing for joy!","Matthew 24.42a, 44",Be watchful and ready: you know not when the Son of Man is coming.,428
Ordinary Time,1,Thursday,II,,"Psalm 27.1, 4, 13-14 (R.13)",I believe that I shall see the good things of the Lord in the land of the living.,Matthew 11.28,"Come to me, all you that labour and are burdened, and I will give you rest, says the Lord.",488
Ordinary Time,1,Thursday,II,,"Psalm 145.2-3, 4-5, 6-7 (R. see 1)","I will praise your name for ever, Lord.","Matthew 24.42a, 44",Be watchful and ready: you know not when the Son of Man is coming.,428
Ordinary Time,1,Thursday,II,,"Psalm 105.2-3, 4-5, 6-7 (R.3b)",Let hearts rejoice who search for the Lord.,Matthew 11.28,"Come to me, all you that labour and are burdened, and I will give you rest, says the Lord.",488
Ordinary Time,1,Friday,I,,"Psalm 78.3+4bc, 6c-7, 8 (R.7b)",Do not forget the works of the Lord!,Luke 7.16,A great prophet has appeared among us; God has visited his people.,309
Ordinary Time,1,Friday,I,,"Psalm 89.15-16, 17-18 (R.1)",For ever I will sing the goodness of the Lord.,Luke 7.16,A great prophet has appeared among us; God has visited his people.,309
Ordinary Time,1,Friday,II,,"Psalm 97.1+2b, 5-6, 10, 11-12 (R.12a)",Let the just rejoice in the Lord.,Luke 21.36,"Be watchful, pray constantly, that you may be worthy to stand before the Son of Man.",429
Ordinary Time,1,Friday,II,,"Psalm 98.1, 2-3ab, 3cd-4 (R.2b)",The Lord has revealed to the nations his saving power.,1 John 2.5,"Whoever keeps the word of Christ, grows perfect in the love of God.",489
Ordinary Time,1,Friday,II,,"Psalm 33.1-2, 4-5, 10ab+11 (R.5b)",The earth is full of the goodness of the Lord.,Luke 21.36,"Be watchful, pray constantly, that you may be worthy to stand before the Son of Man.",429
Ordinary Time,1,Friday,II,,"Psalm 122.1-2, 3-4a, 4b-5 (R.1)",Let us go rejoicing to the house of the Lord.,1 John 2.5,"Whoever keeps the word of Chirst, grows perfect in the love of God.",489
Ordinary Time,1,Saturday,I,,"Psalm 19.7, 8, 9, 14 (R. Jn 6.63c)","Your words, Lord, are spirit and life.",Luke 4.18,The Lord sent me to bring good news to the poor and freedom to prisoners. SARURDAY 117,310
Ordinary Time,1,Saturday,I,,"Psalm 21.1-2, 3-4, 5-6 (R.1)","Lord, your strength gives joy to the king.",Luke 4.18,The Lord sent me to bring good news to the poor and freedom to prisoners.,310
Ordinary Time,1,Saturday,II,,"Psalm 98.1, 7-8, 9 (R. see 9)",The Lord comes to rule the earth with justice.,John 13.34,I give you a new commandment: love one another as I have loved you.,430
Ordinary Time,1,Saturday,II,,"Psalm 145.2-3, 4-5, 10-11 (R. see 2)","I will praise your name for ever, Lord.",2 Corinthians 8.9,"Jesus Christ was rich but he became poor, to make you rich out of his poverty. 1306 THIRTY-FIRST WEEK IN ORDINARY TIME – YEAR I",490
Ordinary Time,1,Saturday,II,,"Psalm 33.12-13, 18-19, 20-21 (R.12b)",Happy the people the Lord has chosen to be his own.,John 13.34,I give you a new commandment: love one another as I have loved you. GO S P E L 1586 TWENTY-FIRST WEEK IN ORDINARY TIME – YEAR II Matthew 25.14-30,430
Ordinary Time,1,Saturday,II,,"Psalm 112.1-2, 5-6, 8a+9 (R.1a)",Happy are those who fear the Lord.,2 Corinthians 8.9,"Jesus Christ was rich but he became poor, to make you rich out of his poverty. SATURDAY 1713",490
Ordinary Time,2,Monday,I,,"Psalm 110.1, 2, 3, 4 (R.4b)",You are a priest forever according to the order of Melchizedek.,Hebrews 4.12,The word of God is alive and active; it judges the thoughts and intentions of the heart.,311
Ordinary Time,2,Monday,I,,"Psalm 50.8-9, 16bc-17, 21+23 (R.23)",I will show the salvation of God to those who do right.,Hebrews 4.12,The word of God is living and active; it probes the thoughts and motives of the heart.,311
Ordinary Time,2,Monday,II,,"Psalm 139.1-3, 4-6, 7-8, 9-10 (R.24b)","Guide me, Lord, along the everlasting way.","Philippians 2.15d, 16a",Shine on the world like bright stars; you are offering it the word of life.,491
Ordinary Time,2,Monday,II,,"Psalm 119.53+61, 134+150, 155+158 (R. see 88)","Give me life, O Lord, and I will do your commands",John 8.12,"I am the light of the world, says the Lord: whoever follows me will have the light of life. 1322 THIRTY-THIRD WEEK IN ORDINARY TIME – YEAR I",497
Ordinary Time,2,Monday,II,,"Psalm 5.1+4, 5-6, 11 (R.8a)","Lead me in your justice, Lord.",John 10.27,"My sheep listen to my voice, says the Lord; I know them and they follow me.",437
Ordinary Time,2,Tuesday,I,,"Psalm 111.1-2, 4-5, 9+10c (R.5)",God is ever mindful of his covenant.,Ephesians 1.17-18,"May the Father of our Lord Jesus Christ enlighten the eyes of our heart, that we might see how great is the hope to which we were called.",312
Ordinary Time,2,Tuesday,I,,"Psalm 89.19, 20-21, 26-27 (R.20)","I have found David, my servant.",Ephesians 1.17-18,"May the Father of our Lord Jesus Christ enlighten the eyes of our heart, that we might see how great is the hope to which we are called.",312
Ordinary Time,2,Tuesday,II,,"Psalm 27.1, 4, 13-14 (R.13)",I believe that I shall see the good things of the Lord in the land of the living.,Luke 7.16,A great prophet has appeared among us; God has visited his people.,432
Ordinary Time,2,Tuesday,II,,"Psalm 34.2-3, 16-17, 18-19 (R. see 2)",I will bless the Lord at all times.,John 14.23,"All who love me will keep my words, and my Father will love them, and we will come to them.",492
Ordinary Time,2,Tuesday,II,,"Psalm 145.8-9, 10-11, 12-13ab, 13cd-14 (R.17a)",The Lord is just in all his ways.,Luke 7.16,A great prophet has appeared among us; God has visited his people.,432
Ordinary Time,2,Tuesday,II,,"Psalm 37.3-4, 18+23, 27+29 (R.39)",The salvation of the just comes from the Lord.,John 14.23,"All who love me will keep my words, and my Father will love them, and we will come to them.",492
Ordinary Time,2,Wednesday,I,,"Psalm 110.1, 2, 3, 4 (R.4)",You are a priest forever in the line of Melchizedek.,Matthew 4.23,Jesus preached the Good News to the people and healed the ones who were sick.,313
Ordinary Time,2,Wednesday,I,,"Psalm 144.1-2, 9-10 (R.1)","Blessed be the Lord, my rock.",Matthew 4.23,Jesus preached the good news of the kingdom and healed all who were sick.,313
Ordinary Time,2,Wednesday,II,,"Psalm 52.8, 9 (R.8b)",I trust in the kindness of God for ever.,Luke 4.18,The Lord sent me to bring good news to the poor and freedom to prisoners.,433
Ordinary Time,2,Wednesday,II,,"Psalm 82.3-4, 6-7 (R.8)","Rise up, O God, bring judgment to the earth.",1 Thessalonians 5.18,"For all things give thanks to God, because this is what God expects of you in Jesus Christ.",493
Ordinary Time,2,Wednesday,II,,"Psalm 33.12-13, 14-15, 20-21 (R.12b)",Happy the people the Lord has chosen to be his own.,Luke 4.18,The Lord sent me to bring good news to the poor and freedom to prisoners.,433
Ordinary Time,2,Wednesday,II,,"Psalm 23.1-3a, 3b-4, 5, 6 (R.1)",The Lord is my shepherd; there is nothing I shall want.,1 Thessalonians 5.18,"For all things give thanks to God, because this is what God expects of you in Jesus Christ.",493
Ordinary Time,2,Thursday,I,,"Psalm 40.6-7a, 7b-8, 9, 16 (R.7-8)","Here am I, Lord;",2 Timothy 1.10b,Our Saviour Jesus Christ destroyed death; and brought life immortal through the gospel. 126 SECOND WEEK IN ORDINARY TIME – YEAR I,314
Ordinary Time,2,Thursday,I,,"Psalm 56.1-2, 8-9ab, 9c-11, 12-13 (R.4)",In God I trust; I am not afraid.,2 Timothy 1.10b,Our Saviour Jesus Christ has done away with death and brought us life through the gospel. 264 SECOND WEEK IN ORDINARY TIME – YEAR II,314
Ordinary Time,2,Thursday,II,,"Psalm 98.2-3ab, 3cd-4, 5-6 (R.2a)",The Lord has made known his salvation.,Matthew 4.19,"Come follow me, says the Lord, and I will make you fishers of my people.",434
Ordinary Time,2,Thursday,II,,"Psalm 119.89-90, 91+130, 135+175 (R.89)","Your word is for ever, O Lord.",John 15.5,"I am the vine and you are the branches, says the Lord: those who live in me, and I in them, will bear much fruit.",494
Ordinary Time,2,Thursday,II,,"Psalm 24.1-2, 3-4ab, 5-6 (R.1a)",To the Lord belongs the earth and all that fills it.,Matthew 4.19,"Come follow me, says the Lord, and I will make you fishers of my people.",434
Ordinary Time,2,Thursday,II,,"Psalm 146.6c-7, 8-9a, 9bc-10 (R.5)",Blest are they whose help is the God of Jacob.,John 15.5,"I am the vine and you are the branches, says the Lord: those who live in me, and I in them, will bear much fruit. 1722 THIRTY-SECOND WEEK IN ORDINARY TIME – YEAR II",494
Ordinary Time,2,Friday,I,,"Psalm 85.7+9, 10-11, 12-13 (R.11)",Kindness and truth shall meet.,2 Corinthians 5.19,"God was in Christ, to reconcile the world to himself; and the good news of reconciliation he has entrusted to us.",315
Ordinary Time,2,Friday,I,,"Psalm 57.1, 2-3, 5+10 (R.1)","Have mercy on me, God, have mercy.",2 Corinthians 5.19,"God was in Christ, to reconcile the world to himself; and the good news of reconciliation he has entrusted to us. FRIDAY 267",315
Ordinary Time,2,Friday,II,,"Psalm 100.1-2, 3, 4, 5 (R.2c)",Come with joy into the presence of the Lord.,John 8.12,"I am the light of the world, says the Lord; whoever follows me will have the light of life.",435
Ordinary Time,2,Friday,II,,"Psalm 19.1-2, 3-4ab (R.2)",The heavens proclaim the glory of God.,Luke 21.28,Lift up your heads and see; your redemption is near at hand.,495
Ordinary Time,2,Friday,II,,"Psalm 37.3-4, 5-6, 27-28, 39-40 (R.39)",The salvation of the just comes from the Lord.,John 8.12,"I am the light of the world, says the Lord; whoever follows me will have the light of life.",435
Ordinary Time,2,Friday,II,,"Psalm 119.1-2, 10-11, 17-18 (R.1a)",Happy are they who follow the law of the Lord!,Luke 21.28,Lift up your heads and see; your redemption is near at hand. 1724 THIRTY-SECOND WEEK IN ORDINARY TIME – YEAR II,495
Ordinary Time,2,Saturday,I,,"Psalm 47.1-2, 5-6, 7-8 (R.5)","God ascends with songs of joy, the sound of trumpets greets the Lord.",,"Acts 16.14b Open our hearts, O Lord, to listen eagerly to the words of your Son. 130 SECOND WEEK IN ORDINARY TIME – YEAR I",316
Ordinary Time,2,Saturday,I,,"Psalm 80.1-2, 4-6 (R.3)","O God, let us see your face that we may be saved.",Acts 16.14b,"Open our hearts, O Lord, to listen to the words of your Son.",316
Ordinary Time,2,Saturday,II,,"Psalm 54.1-2, 4+6",The Lord God is my help.,John 14.6,"I am the way, the truth, and the life, says the Lord; no one comes to the Father, except through me. 1188 TWENTY-SECOND WEEK IN ORDINARY TIME – YEAR I",436
Ordinary Time,2,Saturday,II,,"Psalm 105.2-3, 36-37, 42-43 (R.5a)",Remember the marvels the Lord has done.,2 Thessalonians 2.14,"God has called us with the gospel, to share in the glory of our Lord Jesus Christ. SATURDAY 1319",496
Ordinary Time,2,Saturday,II,,"Psalm 145.17-18, 19-20, 21 (R.18a)",The Lord is near to all who call on him.,John 14.6,"I am the way, the truth, and the life, says the Lord; no one comes to the Father, except through me.",436
Ordinary Time,2,Saturday,II,,"Psalm 112.1-2, 3-4, 5-6 (R.1b)",Happy are those who fear the Lord.,2 Thessalonians 2.14,"God has called us with the gospel, to share in the glory of our Lord Jesus Christ. 1726 THIRTY-SECOND WEEK IN ORDINARY TIME – YEAR II",496
Ordinary Time,3,Monday,I,,"Psalm 98.1, 2-3ab, 3cd-4, 5-6 (R.1a)","Sing to the Lord a new song, for the Lord has done marvellous things.",2 Timothy 1.10b,Our Saviour Jesus Christ has done away with death and brought us life through the gospel.,317
Ordinary Time,3,Monday,I,,"Psalm 89.19, 20-21, 24-25 (R.24a)",My faithfulness and steadfast love shall be with him.,2 Timothy 1.10b,Our Saviour Jesus Christ has done away with death and brought us life through the gospel.,317
Ordinary Time,3,Monday,II,,"Psalm 62.5-6, 7b-8 (R.7a)",In God is my safety and my glory.,John 10.27,"My sheep listen to my voice, says the Lord; I know them and they follow me.",437
Ordinary Time,3,Monday,II,,"Psalm 28.2, 7, 8-9 (R.6)",Blest be the Lord for he has heard my prayer.,John 3.16,"God loved the world so much, he gave his only Son, that all who believe in him might have eternal life.",443
Ordinary Time,3,Monday,II,,"Psalm 1.1-2, 3, 4+6 (R. Rev 2.7b)",Those who are victorious,John 8.12,"I am the light of the world, says the Lord: whoever follows me will have the light of life.",497
Ordinary Time,3,Monday,II,,"Psalm 24.1-2, 3-4ab, 5-6 (R. see 6)","Lord, this is the people that longs to see your face.","Matthew 24.42a, 44",Be watchful and ready: you know not when the Son of Man is coming.,503
Ordinary Time,3,Tuesday,I,,"Psalm 40.1+3ab, 6-7a, 9, 10 (R.7a+8a)","Here am I, Lord; I come to do your will.",See Matthew 11.25,"Blessed are you, Father, Lord of the ruler of heaven and earth; you have revealed to little ones the mysteries of the kingdom. TUESDAY 135",318
Ordinary Time,3,Tuesday,I,,"Psalm 24.7, 8, 9, 10 (R.8a)",Who is this king of glory?,See Matthew 11.25,"Blessed are you, Father, Lord of heaven and earth; you have revealed to little ones the mysteries of the kingdom.",318
Ordinary Time,3,Tuesday,II,,"Psalm 145.1-2, 8-9, 10-11 (R.9)",The Lord is compassionate to all creatures.,John 15.16,"I have chosen you from the world, says the Lord, to go and bear fruit that will last.",438
Ordinary Time,3,Tuesday,II,,"Psalm 3.1-2, 3-4, 5-6 (R.5b)",The Lord upholds me.,1 John 4.10b,God first loved us and sent his Son to take away our sins.,498
Ordinary Time,3,Tuesday,II,,"Psalm 149.1-2, 3-4, 5-6a+9b (R.4a)",The Lord takes delight in his people.,John 15.16,"I have chosen you from the world, says the Lord, to go and bear fruit that will last.",438
Ordinary Time,3,Tuesday,II,,"Psalm 15.1-3a, 3bc-4a, 4b-5 (R. Rev 3.21)",Those who are victorious,1 John 4.10b,God first loved us and sent his Son to take away our sins.,498
Ordinary Time,3,Wednesday,I,,"Psalm 110.1, 2, 3, 4 (R.4)","You are a priest for ever, in the line of Melchizedek.",,"The seed is the word of God, Christ is the sower; all who come to him will live for ever.",319
Ordinary Time,3,Wednesday,I,,"Psalm 89.3-4, 26-27, 28-29 (R.28)",For ever I will pledge my love for my servant.,,"The seed is the word of God, Christ is the sower; all who come to him will live for ever. 276 THIRD WEEK IN ORDINARY TIME – YEAR II",319
Ordinary Time,3,Wednesday,II,,"Psalm 145.2-3, 10-11, 12-13ab (R. see 9)",The Lord is compassionate to all creatures.,Luke 6.23ab,Rejoice and be glad; your reward will be great in heaven.,439
Ordinary Time,3,Wednesday,II,,"Psalm 17.1, 5-6, 8b+15 (R.15)","Lord, when your glory appears, my joy will be full.",John 15.16,"I have chosen you from the world, says the Lord, to go and bear fruit that will last.",499
Ordinary Time,3,Wednesday,II,,"Psalm 45.10-11, 13-14, 15-16 (R.8a)","Listen to me, daughter; see and bend your ear.",Luke 6.23ab,Rejoice and be glad; your reward will be great in heaven.,439
Ordinary Time,3,Wednesday,II,,"Psalm 150.1-2, 3-4, 5-6 (R. Rev 4.8b)","Holy, holy, holy Lord, mighty God!",John 15.16,"I have chosen you from the world, says the Lord, to go and bear fruit that will last.",499
Ordinary Time,3,Thursday,I,,"Psalm 24.1-2, 3-4ab, 5-6 (R.6)","Lord, this is the people that longs to see your face.",Psalm 119.105,Your word is a lamp for my feet and a light on my path.,320
Ordinary Time,3,Thursday,I,,"Psalm 132.1-2, 3-5, 11, 12, 13-14 (R. Lk 1.32b)","God will give him the throne of David, his father.",Psalm 119.105,Your word is a lamp for my feet and a light on my path.,320
Ordinary Time,3,Thursday,II,,"Psalm 150.1-2, 3-4, 5-6 (R.6)",Let everything that breathes praise the Lord.,1 John 4.12,"If we love one another, God will live in us in perfect love.",440
Ordinary Time,3,Thursday,II,,"Psalm 50.1-2, 5-6, 14-15 (R.23b)",To the upright I will show the saving power of God.,Psalm 95.8,"If today you hear God’s voice, harden not your hearts. THURSDAY 1331",500
Ordinary Time,3,Thursday,II,,"Psalm 139.1-3, 13-14ab, 23-24 (R.24b)","Guide me, Lord, along the everlasting way.",1 John 4.12,"If we love one another, God will live in us in perfect love.",440
Ordinary Time,3,Thursday,II,,"Psalm 149.1-2, 3-4, 5-6a+9b (R. Rev 5.10)",The Lamb has made us a kingdom of priests to serve our God.,Psalm 95.8,"If today you hear God’s voice, harden not your hearts.",500
Ordinary Time,3,Friday,I,,"Psalm 37.3-4, 5-6, 23-24, 39-40 (R.39a)",The salvation of the just comes from the Lord.,See Matthew 11.25,"Blessed are you, Father, Lord of heaven and earth; you have revealed to little one the mysteries of the kingdom.",321
Ordinary Time,3,Friday,I,,"Psalm 51.1-2, 3-4a, 4bc-5, 8-9 (R.1a+4a)","Be merciful, O Lord, for we have sinned.",See Matthew 11.25,"Blessed are you, Father, Lord of heaven and earth; you have revealed to little one the mysteries of the kingdom.",321
Ordinary Time,3,Friday,II,,"Psalm 16.1-2a+5, 7-8, 11 (R. see 5a)","You are my inheritance, O Lord.",John 17.17ba,"Your word, O Lord, is truth; make us holy in the truth.",441
